{
  "schemaVersion": "publication-acceptance-request-v1",
  "contractVersion": "0.1.0",
  "idempotencyKey": "agent-run-001",
  "publication": {
    "schemaVersion": "historian-publication-v1",
    "publicationId": "11111111-1111-4111-8111-111111111111",
    "sourceSequence": 1,
    "publishedAt": "2026-08-01T00:00:00Z",
    "payloadHash": "0123456789abcdef0123456789abcdef0123456789abcdef0123456789abcdef",
    "compartmentCount": 2,
    "segmentCount": 3,
    "evidenceCount": 4,
    "summary": "Deterministic publication fixture"
  }
}
